[{"game_id":"2019-W18-HOU-BUF","home_team":"HOU","away_team":"BUF","season":2019,"week":18,"forecast":0.04,"probs":{"logistic":0.033,"tree":0.462,"bt":0.4,"ann":0.172,"blended":0.04},"blend_weights":{"logistic":0.9,"tree":0,"bt":0,"ann":0.1},"calibration":{"pre":0.047,"post":0.04},"ci":{"bt90":[0.4,0.4]},"natural_language":"HOU vs BUF: logistic 3.258%, tree 46.154%, BT 40.048%, ANN 17.239%, blended 3.971%. Key differentials: Turnovers edge +125.56 (favorable); Total yards edge +35.13 (favorable); Penalty yards deficit 2.19 (favorable).","top_drivers":[{"feature":"wins_s2d","direction":"positive","magnitude":4.359748324692758,"source":"logit"},{"feature":"elo_pre","direction":"negative","magnitude":3.586303864078378,"source":"logit"},{"feature":"offensive turnovers","direction":"positive","magnitude":1.3912931150848655,"source":"logit"},{"feature":"CART leaf RRLLLR","direction":"negative","magnitude":0.038461538461538436,"source":"tree"},{"feature":"total yards differential","direction":"positive","magnitude":0.08838709931992236,"source":"bt"},{"feature":"r-ratio differential","direction":"negative","magnitude":0.07838467919614871,"source":"bt"},{"feature":"defensive EPA/play allowed (5wk)","direction":"negative","magnitude":0.0195128494009001,"source":"ann"},{"feature":"wins_s2d","direction":"positive","magnitude":0.017664703048781354,"source":"ann"}],"actual":1},{"game_id":"2019-W18-NE-TEN","home_team":"NE","away_team":"TEN","season":2019,"week":18,"forecast":0.077,"probs":{"logistic":0.035,"tree":0.158,"bt":0.573,"ann":0.582,"blended":0.077},"blend_weights":{"logistic":0.9,"tree":0,"bt":0,"ann":0.1},"calibration":{"pre":0.089,"post":0.077},"ci":{"bt90":[0.573,0.573]},"natural_language":"NE vs TEN: logistic 3.458%, tree 15.789%, BT 57.334%, ANN 58.227%, blended 7.67%. Key differentials: Turnovers edge +44.25 (favorable); Total yards deficit 20.19 (needs attention); Penalty yards deficit 6.50 (favorable).","top_drivers":[{"feature":"elo_pre","direction":"negative","magnitude":6.933955352662807,"source":"logit"},{"feature":"defensive EPA/play allowed (S2D)","direction":"positive","magnitude":3.511492651645044,"source":"logit"},{"feature":"wins_s2d","direction":"positive","magnitude":2.690475317490576,"source":"logit"},{"feature":"CART leaf RRLRLR","direction":"negative","magnitude":0.34210526315789475,"source":"tree"},{"feature":"r-ratio differential","direction":"negative","magnitude":0.12886276263113394,"source":"bt"},{"feature":"total yards differential","direction":"negative","magnitude":0.04586604735809665,"source":"bt"},{"feature":"wins_s2d","direction":"positive","magnitude":0.058885161252199905,"source":"ann"},{"feature":"diff_pass_times_pressured","direction":"negative","magnitude":0.055273154367921414,"source":"ann"}],"actual":0},{"game_id":"2019-W18-NO-MIN","home_team":"NO","away_team":"MIN","season":2019,"week":18,"forecast":0.596,"probs":{"logistic":0.614,"tree":0.839,"bt":0.401,"ann":0.827,"blended":0.596},"blend_weights":{"logistic":0.9,"tree":0,"bt":0,"ann":0.1},"calibration":{"pre":0.635,"post":0.596},"ci":{"bt90":[0.401,0.401]},"natural_language":"NO vs MIN: logistic 61.42%, tree 83.929%, BT 40.086%, ANN 82.655%, blended 59.607%. Key differentials: Turnovers deficit 145.19 (needs attention); Total yards edge +19.19 (favorable); Penalty yards edge +8.81 (needs attention).","top_drivers":[{"feature":"elo_pre","direction":"negative","magnitude":8.821205771368698,"source":"logit"},{"feature":"wins_s2d","direction":"positive","magnitude":6.02902133189494,"source":"logit"},{"feature":"offensive EPA/play (3wk)","direction":"positive","magnitude":2.2693458415732812,"source":"logit"},{"feature":"CART leaf RRLLLL","direction":"positive","magnitude":0.3392857142857143,"source":"tree"},{"feature":"r-ratio differential","direction":"negative","magnitude":0.15323744596914493,"source":"bt"},{"feature":"total yards differential","direction":"positive","magnitude":0.04970398926015418,"source":"bt"},{"feature":"wins_s2d","direction":"positive","magnitude":0.012421430908443352,"source":"ann"},{"feature":"diff_rec_receiving_rat","direction":"positive","magnitude":0.011378178652022862,"source":"ann"}],"actual":0},{"game_id":"2019-W18-PHI-SEA","home_team":"PHI","away_team":"SEA","season":2019,"week":18,"forecast":0.946,"probs":{"logistic":0.976,"tree":0.839,"bt":0.365,"ann":0.758,"blended":0.946},"blend_weights":{"logistic":0.9,"tree":0,"bt":0,"ann":0.1},"calibration":{"pre":0.954,"post":0.946},"ci":{"bt90":[0.365,0.365]},"natural_language":"PHI vs SEA: logistic 97.572%, tree 83.929%, BT 36.468%, ANN 75.809%, blended 94.607%. Key differentials: Turnovers edge +105.25 (favorable); Total yards deficit 19.25 (needs attention); Penalty yards deficit 2.88 (favorable).","top_drivers":[{"feature":"wins_s2d","direction":"positive","magnitude":2.690475317490576,"source":"logit"},{"feature":"losses_s2d","direction":"negative","magnitude":2.172087042275419,"source":"logit"},{"feature":"diff_pass_passing_bad_throws","direction":"positive","magnitude":1.885957525066372,"source":"logit"},{"feature":"CART leaf RRLLLL","direction":"positive","magnitude":0.3392857142857143,"source":"tree"},{"feature":"r-ratio differential","direction":"negative","magnitude":0.04869596094918913,"source":"bt"},{"feature":"total yards differential","direction":"negative","magnitude":0.04359057029575734,"source":"bt"},{"feature":"offensive EPA/play (3wk)","direction":"positive","magnitude":0.01648985459930079,"source":"ann"},{"feature":"off_turnovers_s2d_minus_opp","direction":"negative","magnitude":0.015798383373652986,"source":"ann"}],"actual":0}]