[{"game_id":"2010-W20-CHI-GB","home_team":"CHI","away_team":"GB","season":2010,"week":20,"forecast":0.053,"probs":{"logistic":0,"tree":0.683,"bt":0.494,"ann":0.555,"blended":0.053},"blend_weights":{"logistic":0.9,"tree":0,"bt":0,"ann":0.1},"calibration":{"pre":0.055,"post":0.053},"ci":{"bt90":[0.494,0.494]},"natural_language":"CHI vs GB: logistic 0%, tree 68.293%, BT 49.437%, ANN 55.454%, blended 5.341%. Key differentials: Turnovers edge +571.42 (favorable); Total yards deficit 53.15 (needs attention); Penalty yards edge +10.63 (needs attention).","top_drivers":[{"feature":"elo_pre","direction":"negative","magnitude":7.671172825720863,"source":"logit"},{"feature":"def_turnovers_s2d_minus_opp","direction":"negative","magnitude":3.3763491997032786,"source":"logit"},{"feature":"offensive EPA/play (3wk)","direction":"negative","magnitude":3.29387274215524,"source":"logit"},{"feature":"CART leaf RLL","direction":"positive","magnitude":0.18292682926829273,"source":"tree"},{"feature":"turnover differential","direction":"negative","magnitude":0.06393147448089602,"source":"bt"},{"feature":"total yards differential","direction":"negative","magnitude":0.026752059888651595,"source":"bt"},{"feature":"defensive takeaways","direction":"positive","magnitude":0.02658120950713634,"source":"ann"},{"feature":"def_pass_yds_s2d","direction":"positive","magnitude":0.026221428190988848,"source":"ann"}],"actual":0},{"game_id":"2010-W20-PIT-NYJ","home_team":"PIT","away_team":"NYJ","season":2010,"week":20,"forecast":0.691,"probs":{"logistic":0.71,"tree":0.911,"bt":0.573,"ann":0.599,"blended":0.691},"blend_weights":{"logistic":0.9,"tree":0,"bt":0,"ann":0.1},"calibration":{"pre":0.699,"post":0.691},"ci":{"bt90":[0.573,0.573]},"natural_language":"PIT vs NYJ: logistic 71.017%, tree 91.111%, BT 57.338%, ANN 59.879%, blended 69.06%. Key differentials: Turnovers deficit 301.55 (needs attention); Penalty yards edge +3.92 (needs attention); Total yards edge +0.30 (favorable).","top_drivers":[{"feature":"elo_pre","direction":"negative","magnitude":9.889912428614018,"source":"logit"},{"feature":"offensive EPA/play (3wk)","direction":"positive","magnitude":5.015060874617322,"source":"logit"},{"feature":"losses_s2d","direction":"positive","magnitude":3.211908599742778,"source":"logit"},{"feature":"CART leaf RRRLRL","direction":"positive","magnitude":0.4111111111111111,"source":"tree"},{"feature":"turnover differential","direction":"positive","magnitude":0.03626649286832514,"source":"bt"},{"feature":"r-ratio differential","direction":"negative","magnitude":0.028351642950874285,"source":"bt"},{"feature":"offensive success rate (S2D)","direction":"negative","magnitude":0.017119582158261003,"source":"ann"},{"feature":"defensive EPA/play allowed (exp)","direction":"positive","magnitude":0.016245325528497775,"source":"ann"}],"actual":1}]