[{"game_id":"2016-W18-HOU-LV","home_team":"HOU","away_team":"LV","season":2016,"week":18,"forecast":0.395,"probs":{"logistic":0.294,"tree":0.4,"bt":0.561,"ann":0.751,"blended":0.395},"blend_weights":{"logistic":0.75,"tree":0.15,"bt":0,"ann":0.1},"calibration":{"pre":0.356,"post":0.395},"ci":{"bt90":[0.561,0.561]},"natural_language":"HOU vs LV: logistic 29.434%, tree 40%, BT 56.101%, ANN 75.067%, blended 39.486%. Key differentials: Turnovers edge +550.56 (favorable); Total yards deficit 48.88 (needs attention); Penalty yards deficit 23.94 (favorable).","top_drivers":[{"feature":"defensive takeaways","direction":"negative","magnitude":4.18096004464336,"source":"logit"},{"feature":"wins_s2d","direction":"positive","magnitude":3.8320305107963857,"source":"logit"},{"feature":"offensive EPA/play (S2D)","direction":"negative","magnitude":2.2489887026040973,"source":"logit"},{"feature":"CART leaf RRRLL","direction":"negative","magnitude":0.09999999999999998,"source":"tree"},{"feature":"turnover differential","direction":"negative","magnitude":0.17754408232635974,"source":"bt"},{"feature":"total yards differential","direction":"negative","magnitude":0.12479818516784867,"source":"bt"},{"feature":"off_turnovers_s2d_minus_opp","direction":"negative","magnitude":0.07064631831449723,"source":"ann"},{"feature":"defensive EPA/play allowed (3wk)","direction":"negative","magnitude":0.0575658939459355,"source":"ann"}],"actual":1},{"game_id":"2016-W18-SEA-DET","home_team":"SEA","away_team":"DET","season":2016,"week":18,"forecast":0.856,"probs":{"logistic":0.864,"tree":0.889,"bt":0.746,"ann":0.536,"blended":0.856},"blend_weights":{"logistic":0.75,"tree":0.15,"bt":0,"ann":0.1},"calibration":{"pre":0.835,"post":0.856},"ci":{"bt90":[0.746,0.746]},"natural_language":"SEA vs DET: logistic 86.355%, tree 88.889%, BT 74.608%, ANN 53.59%, blended 85.632%. Key differentials: Turnovers edge +133.00 (favorable); Total yards edge +23.50 (favorable); Penalty yards edge +6.81 (needs attention).","top_drivers":[{"feature":"wins_s2d","direction":"positive","magnitude":9.713213288695371,"source":"logit"},{"feature":"elo_pre","direction":"negative","magnitude":5.122089232033319,"source":"logit"},{"feature":"offensive turnovers","direction":"positive","magnitude":2.454388829807332,"source":"logit"},{"feature":"CART leaf RRRLRR","direction":"positive","magnitude":0.38888888888888884,"source":"tree"},{"feature":"total yards differential","direction":"positive","magnitude":0.0705803242408849,"source":"bt"},{"feature":"turnover differential","direction":"negative","magnitude":0.03541111059544467,"source":"bt"},{"feature":"wins_s2d","direction":"positive","magnitude":0.09171711493338922,"source":"ann"},{"feature":"off_turnovers_s2d_minus_opp","direction":"negative","magnitude":0.07664747656622743,"source":"ann"}],"actual":1},{"game_id":"2016-W18-PIT-MIA","home_team":"PIT","away_team":"MIA","season":2016,"week":18,"forecast":0.865,"probs":{"logistic":0.939,"tree":0.4,"bt":0.671,"ann":0.795,"blended":0.865},"blend_weights":{"logistic":0.75,"tree":0.15,"bt":0,"ann":0.1},"calibration":{"pre":0.844,"post":0.865},"ci":{"bt90":[0.671,0.671]},"natural_language":"PIT vs MIA: logistic 93.911%, tree 40%, BT 67.078%, ANN 79.534%, blended 86.458%. Key differentials: Total yards edge +37.31 (favorable); Turnovers deficit 7.50 (needs attention); Penalty yards deficit 4.56 (favorable).","top_drivers":[{"feature":"wins_s2d","direction":"positive","magnitude":8.242917594220625,"source":"logit"},{"feature":"elo_pre","direction":"negative","magnitude":5.232925944336649,"source":"logit"},{"feature":"defensive takeaways","direction":"negative","magnitude":3.3624907950561433,"source":"logit"},{"feature":"CART leaf RRRRRL","direction":"negative","magnitude":0.09999999999999998,"source":"tree"},{"feature":"total yards differential","direction":"positive","magnitude":0.10786758726275893,"source":"bt"},{"feature":"penalty yards differential","direction":"negative","magnitude":0.0214363495478727,"source":"bt"},{"feature":"off_turnovers_s2d_minus_opp","direction":"negative","magnitude":0.02897946649462099,"source":"ann"},{"feature":"defensive EPA/play allowed (5wk)","direction":"negative","magnitude":0.02423319911941468,"source":"ann"}],"actual":1},{"game_id":"2016-W18-GB-NYG","home_team":"GB","away_team":"NYG","season":2016,"week":18,"forecast":0.507,"probs":{"logistic":0.362,"tree":0.815,"bt":0.445,"ann":0.716,"blended":0.507},"blend_weights":{"logistic":0.75,"tree":0.15,"bt":0,"ann":0.1},"calibration":{"pre":0.465,"post":0.507},"ci":{"bt90":[0.445,0.445]},"natural_language":"GB vs NYG: logistic 36.154%, tree 81.481%, BT 44.474%, ANN 71.632%, blended 50.661%. Key differentials: Turnovers deficit 488.25 (needs attention); Total yards edge +44.19 (favorable); Penalty yards deficit 1.88 (favorable).","top_drivers":[{"feature":"wins_s2d","direction":"positive","magnitude":9.713213288695371,"source":"logit"},{"feature":"defensive takeaways","direction":"negative","magnitude":6.227133168611401,"source":"logit"},{"feature":"RB rush share (3wk)","direction":"negative","magnitude":3.9343344462521865,"source":"logit"},{"feature":"CART leaf RRRRRR","direction":"positive","magnitude":0.31481481481481477,"source":"tree"},{"feature":"turnover differential","direction":"positive","magnitude":0.17605449919430174,"source":"bt"},{"feature":"total yards differential","direction":"positive","magnitude":0.12642685845011703,"source":"bt"},{"feature":"defensive EPA/play allowed (3wk)","direction":"negative","magnitude":0.03435223470772603,"source":"ann"},{"feature":"off_turnovers_s2d_minus_opp","direction":"negative","magnitude":0.031213688913291245,"source":"ann"}],"actual":1}]