[{"game_id":"1999-W18-TEN-BUF","home_team":"TEN","away_team":"BUF","season":1999,"week":18,"forecast":0.953,"probs":{"logistic":0.975,"tree":0.905,"bt":0.626,"ann":0.711,"blended":0.953},"blend_weights":{"logistic":0.9,"tree":0,"bt":0,"ann":0.1},"calibration":{"pre":0.948,"post":0.953},"ci":{"bt90":[0.626,0.626]},"natural_language":"TEN vs BUF: logistic 97.472%, tree 90.476%, BT 62.571%, ANN 71.077%, blended 95.27%. Key differentials: Turnovers deficit 193.19 (needs attention); Penalty yards edge +16.88 (needs attention); Total yards deficit 5.31 (needs attention).","top_drivers":[{"feature":"wins_s2d","direction":"positive","magnitude":7.183240403016635,"source":"logit"},{"feature":"elo_pre","direction":"negative","magnitude":5.097162678744338,"source":"logit"},{"feature":"off_total_yds_s2d_minus_opp","direction":"positive","magnitude":1.5345740195935005,"source":"logit"},{"feature":"CART leaf RLRRRR","direction":"positive","magnitude":0.40476190476190477,"source":"tree"},{"feature":"penalty yards differential","direction":"negative","magnitude":0.06860173869671862,"source":"bt"},{"feature":"turnover differential","direction":"positive","magnitude":0.043898872219382455,"source":"bt"},{"feature":"wins_s2d","direction":"positive","magnitude":0.02685565051792802,"source":"ann"},{"feature":"losses_s2d","direction":"negative","magnitude":0.02182512664742608,"source":"ann"}],"actual":1},{"game_id":"1999-W18-WAS-DET","home_team":"WAS","away_team":"DET","season":1999,"week":18,"forecast":0.834,"probs":{"logistic":0.835,"tree":0.25,"bt":0.409,"ann":0.694,"blended":0.834},"blend_weights":{"logistic":0.9,"tree":0,"bt":0,"ann":0.1},"calibration":{"pre":0.821,"post":0.834},"ci":{"bt90":[0.409,0.409]},"natural_language":"WAS vs DET: logistic 83.46%, tree 25%, BT 40.923%, ANN 69.446%, blended 83.389%. Key differentials: Total yards edge +52.00 (favorable); Penalty yards deficit 11.69 (favorable); Turnovers deficit 11.63 (needs attention).","top_drivers":[{"feature":"wins_s2d","direction":"positive","magnitude":6.03466295624157,"source":"logit"},{"feature":"elo_pre","direction":"negative","magnitude":2.0627938569667448,"source":"logit"},{"feature":"losses_s2d","direction":"negative","magnitude":1.7184635495303557,"source":"logit"},{"feature":"CART leaf RRRR","direction":"negative","magnitude":0.25,"source":"tree"},{"feature":"total yards differential","direction":"positive","magnitude":0.13264354091486807,"source":"bt"},{"feature":"penalty yards differential","direction":"positive","magnitude":0.04553201182449971,"source":"bt"},{"feature":"defensive takeaways","direction":"positive","magnitude":0.0270526250156621,"source":"ann"},{"feature":"wins_s2d","direction":"positive","magnitude":0.026343895332827643,"source":"ann"}],"actual":1},{"game_id":"1999-W18-MIN-DAL","home_team":"MIN","away_team":"DAL","season":1999,"week":18,"forecast":0.656,"probs":{"logistic":0.628,"tree":0.909,"bt":0.499,"ann":0.698,"blended":0.656},"blend_weights":{"logistic":0.9,"tree":0,"bt":0,"ann":0.1},"calibration":{"pre":0.635,"post":0.656},"ci":{"bt90":[0.499,0.499]},"natural_language":"MIN vs DAL: logistic 62.784%, tree 90.909%, BT 49.902%, ANN 69.816%, blended 65.617%. Key differentials: Turnovers edge +507.13 (favorable); Total yards edge +49.56 (favorable); Penalty yards deficit 14.44 (favorable).","top_drivers":[{"feature":"wins_s2d","direction":"positive","magnitude":2.588930615916376,"source":"logit"},{"feature":"elo_pre","direction":"negative","magnitude":2.1006714912399467,"source":"logit"},{"feature":"off_total_yds_s2d_minus_opp","direction":"negative","magnitude":1.7548079059750572,"source":"logit"},{"feature":"CART leaf RLLLR","direction":"positive","magnitude":0.40909090909090906,"source":"tree"},{"feature":"total yards differential","direction":"positive","magnitude":0.12659758381520936,"source":"bt"},{"feature":"turnover differential","direction":"negative","magnitude":0.10393715544042528,"source":"bt"},{"feature":"def_pass_yds_s2d","direction":"positive","magnitude":0.030666905699746064,"source":"ann"},{"feature":"wins_s2d","direction":"positive","magnitude":0.026759324372682743,"source":"ann"}],"actual":1},{"game_id":"1999-W18-SEA-MIA","home_team":"SEA","away_team":"MIA","season":1999,"week":18,"forecast":0.469,"probs":{"logistic":0.426,"tree":0.889,"bt":0.354,"ann":0.623,"blended":0.469},"blend_weights":{"logistic":0.9,"tree":0,"bt":0,"ann":0.1},"calibration":{"pre":0.446,"post":0.469},"ci":{"bt90":[0.354,0.354]},"natural_language":"SEA vs MIA: logistic 42.605%, tree 88.889%, BT 35.356%, ANN 62.286%, blended 46.883%. Key differentials: Turnovers deficit 288.13 (needs attention); Total yards deficit 9.50 (needs attention); Penalty yards deficit 3.38 (favorable).","top_drivers":[{"feature":"wins_s2d","direction":"positive","magnitude":3.737508062691441,"source":"logit"},{"feature":"losses_s2d","direction":"negative","magnitude":3.3607716816441444,"source":"logit"},{"feature":"elo_pre","direction":"negative","magnitude":1.0012378507048882,"source":"logit"},{"feature":"CART leaf RRRLLR","direction":"positive","magnitude":0.38888888888888884,"source":"tree"},{"feature":"turnover differential","direction":"positive","magnitude":0.06394018645545992,"source":"bt"},{"feature":"total yards differential","direction":"negative","magnitude":0.019900607445752144,"source":"bt"},{"feature":"defensive takeaways","direction":"positive","magnitude":0.036655389244264605,"source":"ann"},{"feature":"wins_s2d","direction":"positive","magnitude":0.030345895779321383,"source":"ann"}],"actual":0}]