[{"game_id":"2004-W21-PHI-NE","home_team":"PHI","away_team":"NE","season":2004,"week":21,"forecast":0.2,"probs":{"logistic":0.001,"tree":0.918,"bt":0.556,"ann":0.607,"blended":0.2},"blend_weights":{"logistic":0.75,"tree":0.15,"bt":0,"ann":0.1},"calibration":{"pre":0.199,"post":0.2},"ci":{"bt90":[0.556,0.556]},"natural_language":"PHI vs NE: logistic 0.094%, tree 91.765%, BT 55.589%, ANN 60.663%, blended 19.963%. Key differentials: Turnovers deficit 188.72 (needs attention); Penalty yards edge +9.39 (needs attention); Total yards edge +0.50 (favorable).","top_drivers":[{"feature":"elo_pre","direction":"negative","magnitude":8.897197494884951,"source":"logit"},{"feature":"defensive success rate allowed (3wk)","direction":"positive","magnitude":4.12239784767544,"source":"logit"},{"feature":"offensive success rate (3wk)","direction":"negative","magnitude":3.8369551997633558,"source":"logit"},{"feature":"CART leaf RLLRLL","direction":"positive","magnitude":0.41764705882352937,"source":"tree"},{"feature":"turnover differential","direction":"positive","magnitude":0.08261599980930616,"source":"bt"},{"feature":"penalty yards differential","direction":"negative","magnitude":0.023558559764521474,"source":"bt"},{"feature":"Weather extreme flag","direction":"negative","magnitude":0.04480853365102734,"source":"ann"},{"feature":"def_yds_against_5g","direction":"positive","magnitude":0.03968899863492281,"source":"ann"}],"actual":0}]